{
  "verdict": "PASS",
  "scores": {
    "coverage": 4,
    "scope_discipline": 4,
    "evidence_quality": 4,
    "acceptance_alignment": 4,
    "commit_discipline": 4,
    "recoverability": 4,
    "traceability": 4
  },
  "coverage": {
    "task_execution_pct": 100,
    "scope_violations": 0,
    "notes": "分母 2 条与上游 tasks/ 一致;唯一偏离(auth.ts)有 DECISION 背书,站得住。"
  },
  "strengths": [
    "两条任务的验证证据均为真实输出摘要,抽查重跑 npm test -- --grep orders 与记录一致",
    "先红后绿痕迹在 commit 历史可查(测试与实现同 commit,信息注明)"
  ],
  "critical_issues": [],
  "warnings": [
    "TASK-1.2 的验收对照依赖测试命名与契约对应,后续契约变更时需同步更新测试名"
  ],
  "required_changes": [],
  "evidence_gaps": [],
  "confidence": "high"
}
